id,name,lat,lon,category,subcategory,neighborhood,address,summary,price_range,kid_friendly,visited,rating,website,google_maps_url,tags,notes
will-seat-8-later-at-night-there-s-a-dj-so-beware-that-vibe,"will seat 8. Later at night there's a DJ, so beware that vibe",,,restaurants,restaurant,Mayfair,,,,,,,,,,
windows-the-route-from-the-tube-takes-you-on-a-walk-through-a-neighborhood,"windows, the route from the tube takes you on a walk through a neighborhood",,,restaurants,restaurant,Belgravia,,,,,,,,,,
wingate-and-finchley,Wingate and Finchley,51.610841,-0.180778,attractions,football,London,,Football club in London,,true,,,,,sports|football,Isthmian League Premier Division (Level 7) Stadium: Summers Lane CLUB INFO: https://www.wingatefinchley.com
would-call-a-boozer,would call a boozer),,,restaurants,restaurant,Belgravia,,,,,,,,,,
ye-olde-mitre,Ye Olde Mitre,,,restaurants,restaurant,Belgravia,,close second to Cheshire Cheese. No food,,,,,,,,
zizzi-restaurant,Zizzi Restaurant,51.4089132,-0.3062389,wmd-sites,chemical,,,"Part of a UK-wide Italian restaurant chain, the restaurant was one of the last places the Skripals visited before they were found unconscious.  The Skripals dined at Zizzi in the afternoon. They were ",,,,,,,,"seen behaving normally while eating but began to show symptoms of poisoning soon after leaving the restaurant. Shortly after, they collapsed on a bench near The Maltings shopping area.Following the discovery that they had been poisoned with Novichok, Zizzi was immediately sealed off as a crime scene. Investigators found traces of the nerve agent at the restaurant, particularly on the tableware and chairs used by the Skripals. The contamination led to the restaurant's prolonged closure while it underwent deep cleaning and decontamination. The Maltings Bench (27 The Maltings)-   Shortly after 4:15 PM, passersby noticed them slumped on a bench in The Maltings shopping area.  Witnesses described Sergei Skripal as staring blankly, unresponsive, while Yulia was foaming at the mouth, appearing rigid and unconscious.  First responders initially treated the incident as a possible opioid overdose, given the Skripals' sudden collapse. Upon arrival at Salisbury District Hospital, doctors quickly realized their symptoms were not consistent with drug poisoning.   The UK government later confirmed they had been exposed to Novichok, a Soviet-era military-grade nerve agent."
